{
    "$schema": "http://json-schema.org/draft-07/schema#",
    "title": "Schema for the frankfurter API",
    "type": "object",
    "properties": {
        "amount": {"type": "number"},
        "base": {
            "type": "string",
            "pattern": "^[A-Z]{3}$"
        },
        "date":{
            "type": "string",
            "format": "date"
        },
        "rates":{
            "type": "object",
            "patternProperties": {
                "^[A-Z{3}$]": {"type": "number"}
            },
            "additionalProperties": false
        }
    },
    "required": ["amount", "base", "date", "rates"],
    "additionalProperties": false
}